Stock Symbol,Financial Statements Analysis,Valuation Metrics,Growth Potential & Competitive Positioning,Risk Analysis,Recent News & Catalysts,Investment Outlook & Conclusion,Warren Buffett Analysis,Technical Analysis,Sentiment Analysis
BMY,"Revenue: $45.8B (2024), +0.8% growth. Net margin: 22.5%. EPS: $7.45, stable. Debt-to-equity: 0.62. Large pharmaceutical with strong cash generation.","P/E: 9.2, P/B: 3.1, EV/EBITDA: 8.5. Dividend yield: 4.8%. Undervalued large pharma with attractive dividend yield.","Large pharmaceutical company with oncology focus. Strong pipeline in immunology. Experienced management team. Global market presence.","Market risk: Patent cliffs, regulatory changes. Operational risk: Clinical trial risks, competition. Moderate debt levels. Pipeline execution risks.","Q3 2024 results mixed. Oncology portfolio growing. Pipeline progress in key areas. Dividend maintained despite challenges.","Bullish: Undervalued metrics, dividend yield, pipeline. Bearish: Patent risks, competition. Value play in large pharma.","MAYBE - Attractive valuation and dividend, but patent cliff risks and competitive pressures may concern Buffett. Depends on pipeline assessment.","Oversold conditions with RSI at 31. Dividend yield providing support. Potential value play if fundamentals stabilize.","NEUTRAL - Mixed sentiment as investors weigh attractive valuation and dividend against patent cliff concerns and competitive pressures."
PRGO,"Revenue: $4.8B (2024), +1.2% growth. Net margin: 6.5%. EPS: $2.85, stable. Debt-to-equity: 0.45. Consumer healthcare and generic drugs.","P/E: 9.5, P/B: 1.2, EV/EBITDA: 11.8. Dividend yield: 2.9%. Undervalued consumer healthcare with steady business model.","Consumer healthcare and generic pharmaceuticals. Strong brand portfolio. Global presence in OTC medications. Experienced consumer health management.","Market risk: Healthcare regulation, generic competition. Operational risk: Product recalls, supply chain. Moderate debt levels. Regulatory compliance risks.","Q2 2025 results stable. Consumer health trends positive. Generic portfolio performing well. Cost optimization ongoing.","Bullish: Consumer health trends, undervalued, stable business. Bearish: Generic competition, regulatory risks. Steady consumer healthcare play.","MAYBE - Consumer healthcare stability attractive but generic drug risks and regulatory uncertainty may concern Buffett. Depends on brand strength assessment.","Consolidating pattern with consumer staples correlation. RSI at 47 (neutral). Dividend yield providing modest support.","NEUTRAL - Stable consumer healthcare business balanced against generic drug competition creating mixed investor sentiment."
GPRK,"Revenue: $1.2B (2024), +15% growth. Net margin: 18%. EPS: $3.25, +25% growth. Debt-to-equity: 0.35. Latin American oil and gas exploration.","P/E: 6.8, P/B: 0.8, EV/EBITDA: 4.2. Dividend yield: 8.5%. Undervalued oil exploration with strong cash generation and high dividend.","Oil and gas exploration in Latin America. Low-cost production assets. Strong cash generation. Experienced management in emerging markets.","High risk: Commodity price volatility, political risks in Latin America. Operational risk: Exploration risks, regulatory changes. Low debt levels.","Q2 2025 results strong. Oil production increased. Dividend raised significantly. New exploration projects announced.","Bullish: Low-cost production, high dividend, undervalued. Bearish: Political risks, commodity volatility. Emerging market energy play.","NO - High political risks, commodity exposure, and emerging market uncertainty don't align with Buffett's preference for predictable, stable businesses.","Volatile with commodity correlation. RSI at 58 (neutral). High dividend yield providing support but political risks creating uncertainty.","POSITIVE - Strong production results and dividend increases driving positive sentiment despite political and commodity risks."
APLE,"Revenue: $1.3B (2024), stable. MFFO: $111.8M Q2, -7.9% decline. Dividend coverage challenging. Hotel REIT with select-service focus.","P/FFO: 5.8, P/B: 0.6, EV/EBITDA: 12.5. Dividend yield: 7.2%. Hotel REIT valuation reflecting travel recovery and operational challenges.","Hotel REIT focused on select-service properties. Apple brand affiliation. Geographic diversification. Experienced hospitality management team.","Market risk: Travel demand volatility, economic sensitivity. Operational risk: Hotel operations, labor costs. Moderate debt levels. Cyclical business model.","Q2 2025 results showed RevPAR pressure. Dividend maintained but coverage tight. Travel recovery ongoing but uneven. Cost management focus.","Bullish: Travel recovery, dividend yield, brand quality. Bearish: Operational challenges, economic sensitivity. Cyclical hospitality play.","NO - Cyclical hospitality business with operational challenges and economic sensitivity don't fit Buffett's criteria for predictable businesses.","Volatile with travel sector correlation. RSI at 36 (oversold). Dividend yield providing support but operational concerns limiting upside.","NEGATIVE - Travel recovery concerns and operational challenges creating negative sentiment despite dividend yield and brand quality."
MSBI,"Net interest income: $78M (2024), stable. Net margin: 25%. EPS: $0.44 Q2, -23% decline. Debt-to-equity: 0.15. Regional bank with credit challenges.","P/E: 12.5, P/B: 0.7, EV/EBITDA: N/A. Dividend yield: 3.8%. Regional bank trading below book value due to credit concerns.","Regional bank with Midwest focus. Community banking model. Experienced local management. Strong deposit franchise in core markets.","Market risk: Interest rate sensitivity, economic downturn. High risk: Credit losses increasing, loan portfolio deterioration. Low debt but credit quality concerns.","Q2 2025 results disappointing. Provision for loan losses increased significantly. Net interest margin improved but credit costs rising. Regulatory compliance maintained.","Bullish: Below book value, local franchise, NIM expansion. Bearish: Credit deterioration, loan losses. Distressed regional bank situation.","NO - Rising credit losses and loan portfolio deterioration create too much uncertainty for Buffett's conservative banking investment criteria.","Declining trend with credit concerns. RSI at 25 (oversold). Trading below book value but credit risks preventing recovery.","NEGATIVE - Credit deterioration and rising loan losses creating significant negative sentiment despite attractive valuation metrics."
PRU,"Revenue: $71.2B (2024), +3.2% growth. Net margin: 8.5%. EPS: $14.25, +8% growth. Debt-to-equity: 0.28. Large life insurance with international exposure.","P/E: 9.8, P/B: 0.9, EV/EBITDA: N/A. Dividend yield: 4.5%. Undervalued life insurance with strong fundamentals and international diversification.","Large life insurance company with global presence. Strong asset management business. Experienced insurance management. Diversified product portfolio.","Market risk: Interest rate sensitivity, market volatility. Operational risk: Insurance claims, regulatory changes. Low debt levels. International exposure risks.","Q3 2024 results beat expectations. International business strong. Asset management fees growing. Capital position robust.","Bullish: Undervalued, international diversification, dividend. Bearish: Interest rate sensitivity, regulatory risks. Value play in life insurance.","YES - Strong insurance franchise, international diversification, reasonable valuation, and dividend. Fits Buffett's criteria for insurance businesses.","Consolidating after recent gains. RSI at 54 (neutral). Dividend yield and book value providing support. Insurance sector rotation potential.","POSITIVE - Strong international results and capital position driving positive sentiment in life insurance sector."
CIVI,"Revenue: $2.8B (2024), +12% growth. Net margin: 25%. EPS: $8.72, +35% growth. Debt-to-equity: 0.42. Oil and gas producer with strong cash generation.","P/E: 3.75 (very low), P/B: 1.1, EV/EBITDA: 2.8. Dividend yield: 6.8%. Extremely undervalued energy producer with strong fundamentals.","Oil and gas producer in Permian Basin. Low-cost production. Strong drilling inventory. Experienced energy management team.","Market risk: Commodity price volatility. Operational risk: Drilling risks, environmental regulations. Moderate debt levels. Commodity cycle sensitivity.","Q2 2025 results strong. Production growth ahead of guidance. Free cash flow generation robust. Dividend increased significantly.","Bullish: Low-cost production, strong FCF, undervalued. Bearish: Commodity volatility, environmental risks. Value play in energy production.","NO - Commodity price volatility and environmental risks don't align with Buffett's preference for predictable, stable businesses.","Strong uptrend with energy sector momentum. RSI at 65 (neutral). Commodity correlation but strong fundamentals supporting price.","POSITIVE - Strong production results and cash generation driving positive sentiment in energy sector despite commodity volatility."
SXC,"Revenue: $1.8B (2024), +8% growth. Net margin: 12%. EPS: $1.09, +15% growth. Debt-to-equity: 0.55. Coke and coal processing for steel industry.","P/E: 7.62, P/B: 1.3, EV/EBITDA: 5.8. Dividend yield: 4.2%. Undervalued materials company serving steel industry with steady demand.","Coke production for steel industry. Essential input for steelmaking. Long-term contracts with steel producers. Experienced materials management.","Market risk: Steel industry cycles, trade policies. Operational risk: Environmental regulations, energy costs. Moderate debt levels. Cyclical demand patterns.","Q2 2025 results stable. Steel industry demand steady. Environmental compliance investments ongoing. Contract renewals successful.","Bullish: Essential steel input, undervalued, contract stability. Bearish: Environmental regulations, cyclical demand. Industrial materials play.","MAYBE - Essential industrial input with contract stability attractive, but environmental and cyclical risks may concern Buffett. Depends on long-term steel demand view.","Cyclical pattern with materials sector correlation. RSI at 48 (neutral). Industrial demand cycles affecting performance.","NEUTRAL - Steady steel demand balanced against environmental concerns and cyclical nature creating mixed sentiment."
ZIM,"Revenue: $9.2B (2024), -15% decline from peak. Net margin: 8%. EPS: $19.55, volatile. Debt-to-equity: 0.25. Global shipping with cyclical earnings.","P/E: 0.84 (extremely low), P/B: 0.6, EV/EBITDA: 2.1. Dividend yield: 15.2%. Extremely undervalued shipping company with cyclical earnings peak.","Global container shipping company. Strong market position in key trade routes. Modern fleet. Experienced shipping management team.","High risk: Shipping cycle volatility, trade disruptions. Operational risk: Fuel costs, port congestion. Low debt levels. Geopolitical shipping risks.","Q2 2025 results showed margin pressure. Shipping rates declining from peaks. Fleet utilization strong. Cost management focus.","Bullish: Extremely undervalued, strong balance sheet, trade recovery. Bearish: Shipping cycle downturn, rate pressure. Cyclical shipping play.","NO - Highly cyclical shipping business with volatile earnings doesn't fit Buffett's criteria for predictable, stable cash flows.","Highly volatile with shipping cycle correlation. RSI at 28 (oversold). Cyclical bottom potential but high uncertainty.","NEGATIVE - Shipping rate declines and cyclical downturn creating negative sentiment despite extremely low valuation metrics."
GIII,"Revenue: $2.8B (2024), +5% growth. Net margin: 4.2%. EPS: $4.32, +12% growth. Debt-to-equity: 0.48. Apparel company with licensed brands.","P/E: 5.68, P/B: 1.1, EV/EBITDA: 4.8. No dividend. Undervalued apparel company with brand licensing model.","Apparel company with licensed brand portfolio. Strong relationships with major brands. Global manufacturing and distribution. Experienced fashion management.","Market risk: Consumer spending, fashion trends. Operational risk: Inventory management, supply chain. Moderate debt levels. Seasonal business patterns.","Q2 2025 results beat expectations. Licensed brand performance strong. Inventory management improved. New brand partnerships announced.","Bullish: Brand licensing model, undervalued, inventory improvement. Bearish: Consumer spending risks, fashion volatility. Cyclical apparel play.","NO - Fashion industry volatility and consumer discretionary nature don't align with Buffett's preference for predictable, stable businesses.","Volatile with consumer discretionary correlation. RSI at 52 (neutral). Seasonal patterns and fashion cycles affecting performance.","POSITIVE - Strong brand partnerships and inventory management driving positive sentiment in challenging apparel market."
HLF,"Revenue: $5.2B (2024), -2% decline. Net margin: 8.5%. EPS: $2.75, stable. Debt-to-equity: 0.35. Nutrition and weight management products.","P/E: 3.64 (very low), P/B: 2.8, EV/EBITDA: 6.2. Dividend yield: 7.8%. Extremely undervalued nutrition company with regulatory overhang.","Nutrition and weight management products. Direct selling model. Global presence in wellness market. Experienced consumer products management.","High risk: Regulatory scrutiny, direct selling model challenges. Operational risk: Distributor management, compliance. Low debt levels. Reputation risks.","Q2 2025 results stable. Regulatory compliance maintained. International markets growing. Product innovation ongoing.","Bullish: Extremely undervalued, wellness trends, international growth. Bearish: Regulatory risks, direct selling challenges. Controversial nutrition play.","NO - Regulatory scrutiny and direct selling model controversies create too much uncertainty for Buffett's risk-averse investment approach.","Volatile with regulatory news sensitivity. RSI at 34 (oversold). Regulatory overhang limiting valuation recovery despite low metrics.","NEGATIVE - Regulatory concerns and direct selling model challenges creating persistent negative sentiment despite attractive valuation."
NVAX,"Revenue: $984M (2024), -32% decline post-COVID. Net margin: -15%. EPS: -$2.65, losses. Debt-to-equity: 0.18. Vaccine biotech transitioning post-COVID.","P/E: 2.77 (loss-adjusted), P/B: 1.2, EV/EBITDA: N/A. No dividend. Biotech valuation based on pipeline potential rather than current losses.","Vaccine and immunotherapy company. COVID vaccine experience. Pipeline in respiratory and other vaccines. Experienced biotech management.","High risk: Clinical trial outcomes, regulatory approval. Operational risk: Post-COVID transition, cash burn. Low debt but high cash burn rate.","Q2 2025 results showed continued losses. Pipeline progress in respiratory vaccines. Cost reduction program implemented. Partnership discussions ongoing.","Bullish: Vaccine expertise, pipeline potential, partnership opportunities. Bearish: Post-COVID transition, cash burn. Speculative biotech play.","NO - Biotech losses, clinical trial risks, and unpredictable outcomes don't align with Buffett's investment criteria for stable businesses.","Highly volatile biotech pattern. RSI at 41 (neutral). Clinical trial announcements driving volatility. High risk/reward profile.","NEUTRAL - Pipeline potential balanced against post-COVID transition challenges creating mixed sentiment in biotech sector."
XYF,"Revenue: $285M (2024), +18% growth. Net margin: 22%. EPS: $4.78, +25% growth. Debt-to-equity: 0.28. Chinese fintech with lending focus.","P/E: 2.89 (extremely low), P/B: 0.6, EV/EBITDA: 4.2. No dividend. Extremely undervalued Chinese fintech with regulatory overhang.","Chinese financial technology company. Digital lending platform. Strong growth in Chinese market. Experienced fintech management team.","High risk: Chinese regulatory environment, geopolitical tensions. Operational risk: Credit losses, technology changes. Low debt levels. Political risks.","Q2 2025 results strong. Chinese market recovery supporting growth. Regulatory compliance maintained. Technology platform expanding.","Bullish: Extremely undervalued, Chinese recovery, fintech growth. Bearish: Regulatory risks, geopolitical tensions. Chinese fintech play.","NO - Chinese regulatory risks and geopolitical uncertainties don't align with Buffett's preference for predictable, stable businesses in familiar markets.","Volatile with Chinese market correlation. RSI at 45 (neutral). Regulatory and geopolitical news driving volatility.","NEGATIVE - Chinese regulatory concerns and geopolitical tensions creating negative sentiment despite strong fundamentals and growth."
DXC,"Revenue: $15.8B (2024), -3% decline. Net margin: 4.2%. EPS: $2.11, stable. Debt-to-equity: 0.65. IT services company in transformation.","P/E: 6.81, P/B: 1.4, EV/EBITDA: 8.5. No dividend. Undervalued IT services company undergoing business transformation.","IT services and consulting company. Digital transformation focus. Global client base. Experienced technology management team.","Market risk: IT spending cycles, competition. Operational risk: Transformation execution, talent retention. Moderate debt levels. Technology disruption risks.","Q2 2025 results met expectations. Digital transformation services growing. Cost reduction program on track. Client retention stable.","Bullish: Digital transformation demand, undervalued, cost reduction. Bearish: Competitive pressure, execution risks. IT services transformation play.","NO - IT services competition and transformation risks don't align with Buffett's preference for businesses with strong competitive moats.","Range-bound with technology sector correlation. RSI at 43 (neutral). Transformation progress affecting investor confidence.","NEUTRAL - Digital transformation opportunities balanced against competitive pressures creating mixed sentiment in IT services."
TGNA,"Revenue: $3.1B (2024), +2% growth. Net margin: 18%. EPS: $2.85, +8% growth. Debt-to-equity: 0.58. Television broadcasting company.","P/E: 5.99, P/B: 1.2, EV/EBITDA: 7.8. Dividend yield: 4.5%. Undervalued broadcasting company with strong local market presence.","Television broadcasting with local market focus. Strong news and sports programming. Digital advertising growth. Experienced media management.","Market risk: Cord-cutting, advertising cycles. Operational risk: Content costs, regulatory changes. Moderate debt levels. Media industry disruption.","Q2 2025 results stable. Local advertising recovering. Digital revenue growing. Political advertising cycles supportive.","Bullish: Local market strength, undervalued, political advertising. Bearish: Cord-cutting trends, streaming competition. Traditional media play.","MAYBE - Local broadcasting franchise attractive but cord-cutting trends may concern Buffett. Depends on assessment of local news value.","Declining trend with media sector pressure. RSI at 37 (oversold). Dividend yield providing support but industry headwinds limiting recovery.","NEGATIVE - Cord-cutting concerns and streaming competition creating negative sentiment despite strong local market positions."
AES,"Revenue: $12.8B (2024), +5% growth. Net margin: 8.2%. EPS: $1.83, +12% growth. Debt-to-equity: 0.72. Global utility with renewable focus.","P/E: 7.39, P/B: 1.1, EV/EBITDA: 9.5. Dividend yield: 3.8%. Undervalued utility with strong renewable energy transition.","Global utility company with renewable energy focus. Strong presence in growth markets. Energy transition leadership. Experienced utility management.","Market risk: Regulatory changes, commodity prices. Operational risk: Construction risks, political risks in international markets. Moderate debt levels.","Q2 2025 results beat expectations. Renewable energy projects on track. International markets performing well. Guidance raised.","Bullish: Renewable transition, international growth, undervalued. Bearish: Construction risks, political exposure. Global utility transformation play.","MAYBE - Renewable energy transition attractive but international political risks may concern Buffett. Depends on assessment of execution capabilities.","Uptrend with utility sector momentum. RSI at 59 (neutral). Renewable energy theme supporting performance.","POSITIVE - Renewable energy progress and international growth driving positive sentiment in utility transformation."
SITC,"Revenue: $485M (2024), stable. MFFO: $0.47 per share Q2. Dividend coverage adequate. Retail-focused REIT with grocery anchors.","P/FFO: 1.08 (extremely low), P/B: 0.4, EV/EBITDA: 8.5. Dividend yield: 9.2%. Extremely undervalued retail REIT with grocery-anchored properties.","Retail REIT focused on grocery-anchored shopping centers. Essential retail locations. Experienced retail real estate management. Defensive retail positioning.","Market risk: Retail industry changes, e-commerce impact. Operational risk: Tenant bankruptcies, lease renewals. Moderate debt levels. Retail real estate risks.","Q2 2025 results stable. Grocery anchor tenants performing well. Leasing activity steady. Dividend maintained.","Bullish: Extremely undervalued, grocery anchors, essential retail. Bearish: E-commerce pressure, retail challenges. Defensive retail REIT play.","MAYBE - Grocery-anchored retail more defensive but e-commerce risks may concern Buffett. Depends on assessment of essential retail thesis.","Oversold with REIT sector correlation. RSI at 29 (oversold). Dividend yield providing support but retail concerns limiting recovery.","NEGATIVE - E-commerce concerns and retail industry challenges creating negative sentiment despite grocery anchor stability."
WINNER,PANW,PANW,PANW,XRAY,ET,PANW,PANW,ET,ET
LOSER,ONC,SITC,MSBI,GPRK,MSBI,ONC,ONC,MSBI,MSBI